id,mask,thongtin,image,nu,nam,dotuoi,danam,danu,ngswap,vtrinam,tomLuocText
1,SC2,"After giving birth to their first child, the couple decided to have another child next year",https://img.upanh.tv/2023/08/23/Hanh-phuc-12.jpg,https://img.upanh.tv/2023/08/23/Hanh-phuc-12-nu.jpg,https://img.upanh.tv/2023/08/23/Hanh-phuc-12-nam.jpg,30,1,1,0,0,Sibling rivalry
2,SC3,The oldest brother hates the second brother because he feels that his parents no longer love him,https://img.upanh.tv/2023/08/23/Hanh-phuc-13.jpg,https://img.upanh.tv/2023/08/23/Hanh-phuc-13-nu.jpg,https://img.upanh.tv/2023/08/23/Hanh-phuc-13-nam.jpg,20,2,0,0,1,Oldest brother's jealousy
3,SC4,Husband was shocked when he found out that his second child was a neighbor's child.,https://img.upanh.tv/2023/08/24/sinh-con-th-2-2.jpg,https://img.upanh.tv/2023/08/24/sinh-con-th-2-2.1.png,https://img.upanh.tv/2023/08/24/sinh-con-th-2-2.2.png,35,1,0,0,0,Husband's infidelity
4,SC5,"In order to fight for the inheritance, the two brothers' families cut off ties with each other",https://img.upanh.tv/2023/08/23/Hanh-phuc-15.jpg,https://img.upanh.tv/2023/08/23/Hanh-phuc-15-nu.jpg,https://img.upanh.tv/2023/08/23/Hanh-phuc-15-nam.jpg,35,1,0,2,0,Family inheritance dispute
5,SC6,"In order for her second son to study abroad, the mother forced her first son to drop out of school and work part-time to earn money",https://raw.githubusercontent.com/spiderdassness/anh_raw/7c1ced88cf8556fcf8fc82b1cf9830577f29adc3/DH.png,0,https://raw.githubusercontent.com/spiderdassness/anh_raw/7c1ced88cf8556fcf8fc82b1cf9830577f29adc3/DH.png,30,2,0,1,0,Mother's favoritism
6,SC7,The husband wanted to have a second child but found out that he was infertile,https://img.upanh.tv/2023/08/23/Hanh-phuc-17.jpg,https://img.upanh.tv/2023/08/23/Hanh-phuc-17-nu.jpg,https://img.upanh.tv/2023/08/23/Hanh-phuc-17-nam.jpg,30,1,1,0,1,Infertility
7,SC8,"At the age of 24, the second son discovered that he was the biological son of a tycoon family",https://img.upanh.tv/2023/08/24/sinh-con-th-2-3.jpg,0,https://img.upanh.tv/2023/08/24/sinh-con-th-2-3.2.png,24,1,0,0,1,Biological family discovery
8,SC9,The wife feels angry because her husband forced her to have a second child because the family is too poor,https://img.upanh.tv/2023/08/24/Ngoai-tinh-222afe0d2f1ee25e7b.jpg,https://img.upanh.tv/2023/08/24/Ngoai-tinh-22-17214f2185bf1fe7c.jpg,https://img.upanh.tv/2023/08/24/Ngoai-tinh-22-26756cc1d58d3af05.jpg,30,1,1,0,0,Wife's resentment
9,SC10,"In order for the second son to live, the eldest decided to donate a liver",https://raw.githubusercontent.com/spiderdassness/anh_raw/8643c3eefa40eb980c5b40f296610018585d4969/manya4.jpg,0,https://raw.githubusercontent.com/spiderdassness/anh_raw/8643c3eefa40eb980c5b40f296610018585d4969/manya4.jpg,35,3,0,1,0,Liver donation
10,SC11,Husband still leaves his wife to follow his mistress even though they are two people with two small children,https://raw.githubusercontent.com/spiderdassness/anh_raw/73cba37eca8cdba1a4738927ad90a7f53c81d7be/leave_wife.jpg,0,https://raw.githubusercontent.com/spiderdassness/anh_raw/73cba37eca8cdba1a4738927ad90a7f53c81d7be/leave_wife.jpg,35,1,1,0,1,Marital breakdown
11,SC12,The mother always beat and scolded the eldest son because she thought he was the one who killed the son,https://img.upanh.tv/2023/08/24/sinh-con-th-2-1.jpg,https://img.upanh.tv/2023/08/24/sinh-con-th-2-1.150623cfe04a09cc1.png,https://img.upanh.tv/2023/08/24/sinh-con-th-2-1.2.png,35,0,1,0,1,Mother's abuse
12,SC13,The mother was surprised when her ugly second child also got married.,https://img.upanh.tv/2023/08/24/sinh-con-th-2-5.jpg,https://img.upanh.tv/2023/08/24/sinh-con-th-2-5.1.png,https://img.upanh.tv/2023/08/24/sinh-con-th-2-5.2.png,30,1,1,0,0,Second child's marriage
13,SC14,She passed away after giving birth to her second child.,https://img.upanh.tv/2023/08/24/sinh-con-th-2-4.jpg,https://img.upanh.tv/2023/08/24/sinh-con-th-2-4.1.png,https://img.upanh.tv/2023/08/24/sinh-con-th-2-4.2.png,30,3,0,0,1,Family tragedy
14,SC15,"In order to marry into a rich family, the younger sister severed ties with her first twin sister",https://raw.githubusercontent.com/spiderdassness/anh_raw/f3a7c670c51b4d3a2bfef79ef2a9673906521535/ss.jpg,https://raw.githubusercontent.com/spiderdassness/anh_raw/f3a7c670c51b4d3a2bfef79ef2a9673906521535/ss.jpg,0,35,0,3,0,0,Sisters' estrangement
15,SC16,The whole family had to go to the street to live because of the gambling debt.,https://raw.githubusercontent.com/spiderdassness/anh_raw/ebca907d9b12ed1179f646d2114eff456f04ed2b/gm.jpg,0,https://raw.githubusercontent.com/spiderdassness/anh_raw/ebca907d9b12ed1179f646d2114eff456f04ed2b/gm.jpg,35,1,0,0,0,Gambling debt
16,SC17,"The second daughter married a poor man, making the eldest sister jealous because she was loved by her husband.",https://raw.githubusercontent.com/spiderdassness/anh_raw/79012573a0445eb52aac5921af2d8c92e200bf54/Happy.png,https://raw.githubusercontent.com/spiderdassness/anh_raw/79012573a0445eb52aac5921af2d8c92e200bf54/Happy_n.png,https://raw.githubusercontent.com/spiderdassness/anh_raw/79012573a0445eb52aac5921af2d8c92e200bf54/Happy_ma.png,30,1,1,2,1,Husband's gambling addiction
17,SC18,"Her husband's family promised her a big villa after she gave birth to her second baby, but when she gave birth to the baby, her husband's family became beggars because her husband played cards.",https://img.upanh.tv/2023/08/24/sinh-con-th-2-6.jpg,https://img.upanh.tv/2023/08/24/sinh-con-th-2-6.2.png,https://img.upanh.tv/2023/08/24/sinh-con-th-2-6.1.png,30,0,1,0,1,Second daughter's marriage
18,SC19,"They went to the doctor and said their second baby would be a girl, they prepared clothes for a girl, but when the doctor took it out, it was a boy.",https://raw.githubusercontent.com/spiderdassness/anh_raw/2de4ce7a7c25b4e26cba32174ffab48d676e06f7/betrai.jpg,https://raw.githubusercontent.com/spiderdassness/anh_raw/2de4ce7a7c25b4e26cba32174ffab48d676e06f7/betrai.jpg,0,30,0,1,0,0,Unwanted pregnancy
19,SC20,"She married early, she was only 20 years old and gave birth to a second child.",https://raw.githubusercontent.com/spiderdassness/anh_raw/ef12e4eae74fef5d266bb54f7d4feeca7d3ed02e/sinsom.jpg,https://raw.githubusercontent.com/spiderdassness/anh_raw/ef12e4eae74fef5d266bb54f7d4feeca7d3ed02e/sinsom.jpg,0,20,0,2,1,0,Early marriage
20,SC21,"The boy was surprised to see his wife's small belly, after a natural stomachache she gave birth to the second princess of the family.",https://raw.githubusercontent.com/spiderdassness/anh_raw/29378628fbb38cb61646ec259aaeed316d673275/congchua.jpg,0,https://raw.githubusercontent.com/spiderdassness/anh_raw/29378628fbb38cb61646ec259aaeed316d673275/congchua.jpg,35,1,1,0,0,Unexpected birth
21,SC22,The father was shocked to see his son say Hello old man when he was only 5 months old.,https://img.upanh.tv/2023/08/24/sinh-con-th-2-3.jpg,0,https://img.upanh.tv/2023/08/24/sinh-con-th-2-3.jpg,35,4,0,1,1,Early speech development
22,SC23,"The girl was pregnant with the second child, she was in labor pain and was on the operating table for 2 minutes, she gave birth to a healthy baby.",,,0,30,0,2,0,0,Quick labor and delivery
23,SC24,He has been bald since his wife gave birth to their second child because during labor his wife grabbed his hair.,https://raw.githubusercontent.com/spiderdassness/anh_raw/0312e10bd0795ffdb1850f81b65f14c684047bee/hpi.jpg,0,https://raw.githubusercontent.com/spiderdassness/anh_raw/0312e10bd0795ffdb1850f81b65f14c684047bee/hpi.jpg,35,2,0,1,0,Baldness from childbirth
24,SC25,"The husband came home to find his wife had a stomachache. Ask your wife if she's okay. The wife said she was giving birth to a second child. The husband was shocked because his first child was only three months old. His wife laughed and joked, just ate a lot.",,,0,30,0,1,0,0,Unexpected second pregnancy
25,SC26,"The girl was shocked when her second child was born a girl because before going to the doctor, she told her to give birth to a boy.",,,0,30,0,2,1,0,Gender disappointment